{
  "$schema": "http://json-schema.org/draft-07/schema#",
  "$id": "https://github.com/wadewu-ml/polygravity/blob/main/src/locales/locale.schema.json",
  "title": "Antigravity locale definition",
  "description": "Language data consumed by src/locale.js and injected into the locale-neutral engine at src/patches/engine.jsfrag. Adding a language means adding one file of this shape.",
  "type": "object",
  "required": ["language", "name", "text"],
  "additionalProperties": false,
  "properties": {
    "$schema": {
      "type": "string",
      "description": "Points at this file so editors can offer completion and validation."
    },
    "language": {
      "type": "string",
      "description": "BCP 47 locale code. Must match the file name, e.g. zh-CN for zh-CN.json.",
      "pattern": "^[A-Za-z]{2,3}(-[A-Za-z0-9]{2,8})*$"
    },
    "name": {
      "type": "string",
      "description": "Display name written in the language itself, e.g. 简体中文.",
      "minLength": 1
    },
    "englishName": {
      "type": "string",
      "description": "English display name used in CLI listings, e.g. Simplified Chinese."
    },
    "htmlLang": {
      "type": "string",
      "description": "Value written to <html lang>. Defaults to 'language' when omitted."
    },
    "dir": {
      "enum": ["ltr", "rtl"],
      "description": "Writing direction written to <html dir>. Required for right-to-left languages; a translated RTL locale without it still lays out left to right."
    },
    "chromiumLang": {
      "type": "string",
      "description": "Value passed to Chromium's --lang switch, which drives native dialogs, spell checking and date formatting. Defaults to 'language'.",
      "pattern": "^[A-Za-z0-9-]+$"
    },
    "pluralLocale": {
      "type": "string",
      "description": "Locale whose CLDR plural rules apply, for a regional code Intl.PluralRules does not resolve on its own. Defaults to 'language'.",
      "pattern": "^[A-Za-z]{2,3}(-[A-Za-z0-9]{2,8})*$"
    },
    "punctuation": {
      "type": "object",
      "description": "ASCII punctuation to localized punctuation, applied only to trailing punctuation of a dictionary hit. Leave empty for languages that keep ASCII punctuation.",
      "additionalProperties": { "type": "string" }
    },
    "punctuationSkipSuffixes": {
      "type": "array",
      "description": "If a translation already ends with one of these, trailing punctuation is not appended again.",
      "items": { "type": "string" }
    },
    "patterns": {
      "type": "array",
      "description": "Rules for strings containing runtime values (counts, durations, model names) that cannot be listed in 'text'.",
      "items": {
        "type": "object",
        "required": ["pattern", "sample"],
        "additionalProperties": false,
        "properties": {
          "id": {
            "type": "string",
            "description": "Unique identifier used in validation errors. Duplicates are rejected."
          },
          "pattern": {
            "type": "string",
            "description": "JavaScript regular expression source. Anchor it with ^...$ so it cannot match a substring of unrelated UI text."
          },
          "flags": {
            "type": "string",
            "description": "Non-stateful regex flags, typically 'i'. Global and sticky flags are rejected because dynamic rules need capture groups from one exact match.",
            "pattern": "^[dimsuv]*$"
          },
          "template": {
            "type": "string",
            "description": "Output text for languages with no plural agreement. {1}, {2}, ... expand to capture groups; referencing a group the pattern does not have is rejected. Mutually exclusive with 'templates'."
          },
          "templates": {
            "type": "object",
            "description": "Plural forms for a counted string, keyed by CLDR plural category (zero, one, two, few, many, other) or by an exact count such as \"=0\". The category is selected with Intl.PluralRules for this language. 'other' is required as the fallback. Mutually exclusive with 'template'.",
            "required": ["other"],
            "propertyNames": { "pattern": "^(zero|one|two|few|many|other|=[0-9]+)$" },
            "additionalProperties": { "type": "string", "minLength": 1 }
          },
          "pluralGroup": {
            "type": "integer",
            "description": "Capture group holding the count that selects the plural form. Defaults to 1.",
            "minimum": 1
          },
          "replace": {
            "type": "object",
            "description": "Capture group index to the name of a valueMaps or valueRules entry used to localize that group.",
            "propertyNames": { "pattern": "^[0-9]+$" },
            "additionalProperties": { "type": "string" }
          },
          "trimGroups": {
            "type": "array",
            "description": "Capture group indexes whose surrounding whitespace is stripped before lookup.",
            "items": { "type": "integer", "minimum": 1 }
          },
          "sample": {
            "type": "string",
            "description": "Representative input. The test suite asserts the rule matches this string and actually changes it."
          }
        }
      }
    },
    "valueMaps": {
      "type": "object",
      "description": "Named lookup tables for enumerable captured values. Unmatched values fall through unchanged.",
      "additionalProperties": {
        "type": "object",
        "additionalProperties": { "type": "string" }
      }
    },
    "valueRules": {
      "type": "object",
      "description": "Named regex pipelines for captured values that are not enumerable, such as '2 days, 3 hours'. Each step is applied in order.",
      "additionalProperties": {
        "type": "array",
        "items": {
          "type": "object",
          "required": ["pattern", "template"],
          "additionalProperties": false,
          "properties": {
            "pattern": { "type": "string" },
            "flags": { "type": "string", "pattern": "^[dgimsuvy]*$" },
            "template": { "type": "string" }
          }
        }
      }
    },
    "menu": {
      "type": "object",
      "description": "Native application menu labels. Applied in the main process, not the renderer, so these are kept out of the preload fragment.",
      "additionalProperties": { "type": "string" }
    },
    "text": {
      "type": "object",
      "description": "Static dictionary: exact English UI string to its translation. Keys must not have surrounding whitespace and values must be non-empty.",
      "minProperties": 1,
      "additionalProperties": { "type": "string", "minLength": 1 }
    }
  }
}
