{
  "$schema": "./locale.schema.json",
  "language": "es",
  "name": "Español",
  "englishName": "Spanish",
  "htmlLang": "es",
  "dir": "ltr",
  "text": {
    "Run": "Ejecutar",
    "Agent": "Agente",
    "Configure agent execution, queued message delivery, and permissions.": "Configura la ejecución del agente, la entrega de mensajes en cola y los permisos.",
    "Execution": "Ejecución",
    "Queued Messages": "Mensajes en cola",
    "Configure when follow-up messages are sent.": "Configura cuándo se envían los mensajes de seguimiento.",
    "Queue After Turn": "Poner en cola tras el turno",
    "Send Immediately": "Enviar de inmediato",
    "Plan": "Suscripción",
    "Your Plan:": "Tu plan:",
    "You can upgrade to a Google AI Ultra plan to receive higher rate limits.": "Puedes actualizar a un plan Google AI Ultra para obtener límites más altos.",
    "You can upgrade to a": "Puedes actualizar a un",
    "plan to receive higher rate limits.": "plan para obtener límites más altos.",
    "Configure the browser subagent. It requires Google Chrome": "Configura el subagente de navegador. Requiere tener Google Chrome",
    "to be installed.": "instalado.",
    "The browser subagent can be invoked by typing /browser in the conversation input box.": "El subagente de navegador se invoca escribiendo /browser en el cuadro de entrada de la conversación.",
    "Terms of Service": "Términos del Servicio",
    "By using this app, you agree to its": "Al usar esta aplicación, aceptas sus",
    "You currently don't have any MCP Servers installed.": "Actualmente no tienes ningún servidor MCP instalado.",
    "Add an MCP server above or add a custom one via the MCP Config.": "Añade un servidor MCP arriba o añade uno personalizado mediante la configuración de MCP.",
    "Add MCP": "Añadir MCP",
    "Open MCP Config": "Abrir configuración de MCP",
    "MCP Config": "Configuración de MCP",
    "Also includes": "También incluye",
    "global settings": "la configuración global",
    "when working in this project.": "cuando trabajas en este proyecto.",
    "New Conversation in Project": "Nueva conversación en el proyecto",
    "Loading": "Cargando",
    "See less": "Ver menos",
    "Install IDE": "Instalar IDE",
    "Load older messages": "Cargar mensajes anteriores",
    "Undo changes up to this point": "Deshacer los cambios hasta este punto",
    "Message input": "Entrada de mensaje",
    "Overview": "Resumen",
    "Auxiliary Pane": "Panel auxiliar",
    "Select Environment": "Seleccionar entorno",
    "New Conversation": "Nueva conversación",
    "Conversation History": "Historial de conversaciones",
    "Scheduled Tasks": "Tareas programadas",
    "Projects": "Proyectos",
    "Settings": "Configuración",
    "General": "General",
    "Account": "Cuenta",
    "Permissions": "Permisos",
    "Appearance": "Apariencia",
    "Models": "Modelos",
    "Customizations": "Personalizaciones",
    "Browser": "Navegador",
    "Not in Project": "Fuera de proyecto",
    "Conversations": "Conversaciones",
    "Shortcuts": "Atajos",
    "Provide Feedback": "Enviar comentarios",
    "Configure the agent's visual theme and display preferences.": "Configura el tema visual del agente y las preferencias de visualización.",
    "Chat Settings": "Ajustes de chat",
    "Verbose agent chat": "Chat detallado del agente",
    "Display and preserve intermediate thinking steps": "Mostrar y conservar los pasos intermedios de razonamiento",
    "Select light, dark, or inherit system settings.": "Selecciona claro, oscuro o heredar la configuración del sistema.",
    "Light Theme": "Tema claro",
    "Dark Theme": "Tema oscuro",
    "Preset": "Preajuste",
    "Default Light": "Claro predeterminado",
    "Default Dark": "Oscuro predeterminado",
    "System": "Sistema",
    "Light": "Claro",
    "Dark": "Oscuro",
    "Background": "Fondo",
    "Foreground": "Primer plano",
    "Accent": "Acento",
    "Local": "Local",
    "Ask anything, @ to mention, / for actions": "Pregunta lo que quieras, @ para mencionar, / para acciones",
    "New Window": "Nueva ventana",
    "No agents running": "No hay agentes en ejecución",
    "Open Antigravity": "Abrir Antigravity",
    "Authentication Required": "Autenticación requerida",
    "To start using the agent, please sign in with your Google account.": "Para empezar a usar el agente, inicia sesión con tu cuenta de Google.",
    "Sign In": "Iniciar sesión",
    "Open Settings": "Abrir configuración",
    "There was an unexpected issue setting up your account.": "Hubo un problema inesperado al configurar tu cuenta.",
    "Continue with different account": "Continuar con otra cuenta",
    "Having trouble? Let us know": "¿Tienes problemas? Cuéntanos",
    "Previous": "Anterior",
    "Next": "Siguiente",
    "Retry": "Reintentar",
    "Cancel": "Cancelar",
    "Save": "Guardar",
    "Close": "Cerrar",
    "Quit": "Salir",
    "Check for Updates": "Buscar actualizaciones",
    "Checking for Updates...": "Buscando actualizaciones...",
    "Downloading Update...": "Descargando actualización...",
    "Restart to Update": "Reiniciar para actualizar",
    "File": "Archivo",
    "Edit": "Editar",
    "View": "Ver",
    "Window": "Ventana",
    "Help": "Ayuda",
    "App": "Aplicación",
    "Workspace": "Espacio de trabajo",
    "Start a new chat": "Iniciar un chat nuevo",
    "Search conversations": "Buscar conversaciones",
    "Delete conversation": "Eliminar conversación",
    "Rename conversation": "Cambiar nombre de la conversación",
    "Clear all conversations": "Borrar todas las conversaciones",
    "Export conversation": "Exportar conversación",
    "Export as Markdown": "Exportar como Markdown",
    "Export as JSON": "Exportar como JSON",
    "Share conversation": "Compartir conversación",
    "Previous 7 days": "Últimos 7 días",
    "Previous 30 days": "Últimos 30 días",
    "No history found": "No se encontró historial",
    "Pin conversation": "Fijar conversación",
    "Unpin conversation": "Dejar de fijar conversación",
    "Conversation details": "Detalles de la conversación",
    "View original message": "Ver mensaje original",
    "Copy conversation": "Copiar conversación",
    "Copy block": "Copiar bloque",
    "Edit message": "Editar mensaje",
    "Regenerate response": "Regenerar respuesta",
    "Response regenerated": "Respuesta regenerada",
    "Keep reading": "Seguir leyendo",
    "Show raw markdown": "Mostrar Markdown sin formato",
    "Rendered view": "Vista renderizada",
    "Collapse message": "Contraer mensaje",
    "Expand message": "Expandir mensaje",
    "Scroll to bottom": "Desplazar al final",
    "Type a message...": "Escribe un mensaje...",
    "Send message": "Enviar mensaje",
    "Stop generating": "Detener generación",
    "Stop agent": "Detener agente",
    "Add attachment": "Añadir adjunto",
    "Upload file": "Subir archivo",
    "Upload folder": "Subir carpeta",
    "Drop files here": "Arrastra archivos aquí",
    "Attach from project": "Adjuntar desde el proyecto",
    "Select model": "Seleccionar modelo",
    "Current model": "Modelo actual",
    "Default model": "Modelo predeterminado",
    "Advanced models": "Modelos avanzados",
    "Recommended models": "Modelos recomendados",
    "System prompt": "Prompt del sistema",
    "Context window": "Ventana de contexto",
    "Max output tokens": "Tokens máximos de salida",
    "Temperature": "Temperatura",
    "Top P": "Muestreo Top P",
    "Mention agent": "Mencionar agente",
    "Use slash commands": "Usar comandos con barra",
    "No command found": "No se encontró ningún comando",
    "Available commands": "Comandos disponibles",
    "Search files...": "Buscar archivos...",
    "Clear input": "Borrar entrada",
    "Multi-line input": "Entrada multilínea",
    "Press Enter to send": "Pulsa Intro para enviar",
    "Press Shift+Enter for new line": "Pulsa Shift+Intro para nueva línea",
    "Token count": "Recuento de tokens",
    "Audio input": "Entrada de audio",
    "Agent is thinking...": "El agente está pensando...",
    "Thinking process": "Proceso de razonamiento",
    "Hide thinking process": "Ocultar proceso de razonamiento",
    "Show thinking process": "Mostrar proceso de razonamiento",
    "Agent is executing steps...": "El agente está ejecutando pasos...",
    "Task started": "Tarea iniciada",
    "Task paused": "Tarea en pausa",
    "Task completed": "Tarea completada",
    "Task failed": "Tarea fallida",
    "Executing command": "Ejecutando comando",
    "Step completed": "Paso completado",
    "Agent status": "Estado del agente",
    "Waiting for user input": "Esperando la entrada del usuario",
    "Waiting for approval": "Esperando aprobación",
    "Approve action": "Aprobar acción",
    "Reject action": "Rechazar acción",
    "Plan generated": "Plan generado",
    "Viewing execution plan": "Viendo el plan de ejecución",
    "Execution history": "Historial de ejecución",
    "Review changes": "Revisar cambios",
    "Agent paused": "Agente en pausa",
    "Resume agent": "Reanudar agente",
    "Analyzing progress": "Analizando el progreso",
    "Generating plan...": "Generando plan...",
    "Auto-running...": "Ejecutando automáticamente...",
    "Call tool": "Llamar herramienta",
    "Tool execution success": "Herramienta ejecutada con éxito",
    "Tool execution failed": "Error en la ejecución de la herramienta",
    "MCP server": "Servidor MCP",
    "MCP servers": "Servidores MCP",
    "Connect server": "Conectar servidor",
    "Disconnect server": "Desconectar servidor",
    "Configure MCP": "Configurar MCP",
    "Add MCP server": "Añadir servidor MCP",
    "Web browser": "Navegador web",
    "Open in browser": "Abrir en el navegador",
    "Browser control": "Control del navegador",
    "Take screenshot": "Tomar captura de pantalla",
    "Navigate to URL": "Ir a la URL",
    "Terminal window": "Ventana de terminal",
    "Run in terminal": "Ejecutar en terminal",
    "Terminal execution": "Ejecución en terminal",